{
  "schema_version": "0.1",
  "node_id": "node-01",
  "device": {
    "manufacturer": "POCO",
    "model": "POCO X7 Pro 5G",
    "android_version": "TBD",
    "abi": "arm64-v8a",
    "soc": "MediaTek Dimensity 8400-Ultra",
    "gpu": "Mali-G720",
    "npu": "8th-generation MediaTek NPU"
  },
  "runtime": {
    "kind": "llama.cpp",
    "version": "TBD",
    "commit": null
  },
  "resources": {
    "physical_ram_mb": 12288,
    "memory_extension_enabled": null,
    "memory_extension_mb": null,
    "storage_total_mb": 524288,
    "storage_free_mb": 300000
  },
  "health": {
    "status": "ready",
    "battery_percent": 78,
    "charging": false,
    "temperature_c": 36.0,
    "thermal_state": "normal"
  },
  "services": [
    {
      "type": "llm",
      "status": "ready",
      "model": "qwen-main",
      "family": "qwen",
      "runtime": "llama.cpp",
      "model_status": "loaded",
      "quantization": "Q4",
      "size_bytes": 4500000000,
      "context_max": 8192,
      "endpoint": "http://node-01:8080"
    },
    {
      "type": "speech_to_text",
      "status": "ready",
      "model": "whisper-small",
      "family": "whisper",
      "runtime": "whisper.cpp",
      "model_status": "cold",
      "quantization": null,
      "size_bytes": 500000000,
      "context_max": null,
      "endpoint": null
    }
  ]
}
